{
  "kind": "review_bundle_manifest.v1",
  "project": "metadata_baseline",
  "bundle_id": "metadata-baseline-plan-merge-001",
  "iteration_id": "iteration-0001",
  "scope_root": "/home/_404/src/repo_intel/metadata_baseline",
  "reviewed_head": "1aa193afbe52bfdb0e64a16473cf5af57af2ecb6",
  "output_root": "/home/_404/src/loop_ledger/bundles/metadata_baseline/metadata-baseline-plan-merge-001/iteration-0001",
  "refs": {
    "upstream_project": "/home/_404/src/repo_intel/metadata_baseline",
    "source_review_bundle": "/home/_404/src/repo_intel/metadata_baseline/review/bundles/metadata-baseline-plan-merge-001"
  },
  "evidence_bundle": {
    "required_outputs": [],
    "required_checks": [],
    "integrity_mode": "all_files"
  },
  "include": [
    {
      "source": "/home/_404/src/repo_intel/metadata_baseline/review/bundles/metadata-baseline-plan-merge-001/merged_surface.json",
      "dest": "merged_surface.json",
      "role": "merged_surface_contract",
      "repo_key": "metadata_baseline",
      "repo_relative_path": "review/bundles/metadata-baseline-plan-merge-001/merged_surface.json",
      "head": "1aa193afbe52bfdb0e64a16473cf5af57af2ecb6",
      "absolute_path": "/home/_404/src/repo_intel/metadata_baseline/review/bundles/metadata-baseline-plan-merge-001/merged_surface.json"
    },
    {
      "source": "/home/_404/src/repo_intel/metadata_baseline/review/bundles/metadata-baseline-plan-merge-001/merged_micro_deliverables.json",
      "dest": "merged_micro_deliverables.json",
      "role": "merged_micro_deliverable_inventory",
      "repo_key": "metadata_baseline",
      "repo_relative_path": "review/bundles/metadata-baseline-plan-merge-001/merged_micro_deliverables.json",
      "head": "1aa193afbe52bfdb0e64a16473cf5af57af2ecb6",
      "absolute_path": "/home/_404/src/repo_intel/metadata_baseline/review/bundles/metadata-baseline-plan-merge-001/merged_micro_deliverables.json"
    },
    {
      "source": "/home/_404/src/repo_intel/metadata_baseline/review/bundles/metadata-baseline-plan-merge-001/merged_release_plan.json",
      "dest": "merged_release_plan.json",
      "role": "merged_release_plan",
      "repo_key": "metadata_baseline",
      "repo_relative_path": "review/bundles/metadata-baseline-plan-merge-001/merged_release_plan.json",
      "head": "1aa193afbe52bfdb0e64a16473cf5af57af2ecb6",
      "absolute_path": "/home/_404/src/repo_intel/metadata_baseline/review/bundles/metadata-baseline-plan-merge-001/merged_release_plan.json"
    },
    {
      "source": "/home/_404/src/repo_intel/metadata_baseline/review/bundles/metadata-baseline-plan-merge-001/ref_header.json",
      "dest": "source/ref_header.json",
      "role": "source_plan_ref_header",
      "repo_key": "metadata_baseline",
      "repo_relative_path": "review/bundles/metadata-baseline-plan-merge-001/ref_header.json",
      "head": "1aa193afbe52bfdb0e64a16473cf5af57af2ecb6",
      "absolute_path": "/home/_404/src/repo_intel/metadata_baseline/review/bundles/metadata-baseline-plan-merge-001/ref_header.json"
    },
    {
      "source": "/home/_404/src/repo_intel/metadata_baseline/review/bundles/metadata-baseline-plan-merge-001/artifacts.manifest.json",
      "dest": "source/artifacts.manifest.json",
      "role": "source_plan_artifacts_manifest",
      "repo_key": "metadata_baseline",
      "repo_relative_path": "review/bundles/metadata-baseline-plan-merge-001/artifacts.manifest.json",
      "head": "1aa193afbe52bfdb0e64a16473cf5af57af2ecb6",
      "absolute_path": "/home/_404/src/repo_intel/metadata_baseline/review/bundles/metadata-baseline-plan-merge-001/artifacts.manifest.json"
    }
  ],
  "source_roots": {
    "metadata_baseline": {
      "root": "/home/_404/src/repo_intel/metadata_baseline",
      "head": "1aa193afbe52bfdb0e64a16473cf5af57af2ecb6"
    }
  },
  "controller_surfaces": {
    "metadata_baseline": {
      "root": "/home/_404/src/repo_intel/metadata_baseline",
      "head": "1aa193afbe52bfdb0e64a16473cf5af57af2ecb6"
    }
  }
}
